{
  "from": "+19195551234",
  "to": "+19195554321",
  "answerUrl": "https://example.com/callback",
  "answerMethod": "POST",
  "answerFallbackUrl": "https://example.com/callback",
  "answerFallbackMethod": "POST",
  "disconnectUrl": "https://example.com/callback",
  "disconnectMethod": "POST",
  "applicationId": "c-abc123",
  "tag": "sample-value",
  "callTimeout": 25.92,
  "callbackTimeout": 13.17
}